{
  "$schema": "https://json-schema.org/draft/2020-12/schema",
  "$id": "https://paneforge.local/method-layer/adapter/v0.1/handoff-envelope.internal.schema.json",
  "title": "PaneForge Method Layer Handoff Envelope",
  "type": "object",
  "required": [
    "schemaVersion",
    "envelopeType",
    "operation",
    "handoffPath",
    "handoffSha256",
    "taskBindingLookup",
    "taskBindingPatch"
  ],
  "properties": {
    "schemaVersion": {
      "const": "0.1-internal"
    },
    "envelopeType": {
      "const": "handoff-envelope"
    },
    "operation": {
      "const": "new-handoff"
    },
    "handoffPath": {
      "$ref": "#/$defs/relativePath"
    },
    "handoffSha256": {
      "$ref": "#/$defs/sha256"
    },
    "taskBindingLookup": {
      "$ref": "#/$defs/taskBindingLookup"
    },
    "taskBindingPatch": {
      "$ref": "#/$defs/methodMetadataPatch"
    }
  },
  "additionalProperties": false,
  "$defs": {
    "relativePath": {
      "type": "string",
      "minLength": 1,
      "pattern": "^(?![A-Za-z]:[\\\\/])(?![\\\\/]{2})(?![\\\\/]).+"
    },
    "sha256": {
      "type": "string",
      "pattern": "^[0-9A-Fa-f]{64}$"
    },
    "taskId": {
      "type": "string",
      "minLength": 3,
      "maxLength": 128,
      "pattern": "^[A-Za-z0-9][A-Za-z0-9._:-]{2,127}$"
    },
    "runId": {
      "type": "string",
      "pattern": "^run-[A-Za-z0-9][A-Za-z0-9._:-]{1,123}$"
    },
    "taskBindingLookup": {
      "type": "object",
      "required": [
        "operation",
        "sessionId",
        "fallback"
      ],
      "properties": {
        "operation": {
          "const": "find_task_binding_by_session"
        },
        "sessionId": {
          "type": "string",
          "minLength": 1
        },
        "fallback": {
          "const": "manual-review"
        }
      },
      "additionalProperties": false
    },
    "methodMetadataPatch": {
      "type": "object",
      "required": [
        "metadata"
      ],
      "properties": {
        "metadata": {
          "type": "object",
          "required": [
            "methodLayer"
          ],
          "properties": {
            "methodLayer": {
              "type": "object",
              "required": [
                "protocolVersion",
                "taskId",
                "runId",
                "artifactRoot",
                "taskPath",
                "runPath",
                "latestEvidencePath",
                "latestHandoffPath"
              ],
              "properties": {
                "protocolVersion": {
                  "const": "0.1"
                },
                "taskId": {
                  "$ref": "#/$defs/taskId"
                },
                "runId": {
                  "$ref": "#/$defs/runId"
                },
                "artifactRoot": {
                  "$ref": "#/$defs/relativePath"
                },
                "taskPath": {
                  "$ref": "#/$defs/relativePath"
                },
                "runPath": {
                  "$ref": "#/$defs/relativePath"
                },
                "latestEvidencePath": {
                  "$ref": "#/$defs/relativePath"
                },
                "latestHandoffPath": {
                  "$ref": "#/$defs/relativePath"
                }
              },
              "additionalProperties": false
            }
          },
          "additionalProperties": false
        }
      },
      "additionalProperties": false
    }
  }
}
